<?xml version="1.0" encoding="UTF-8"?>
<!--
Click nbfs://nbhost/SystemFileSystem/Templates/Licenses/license-default.txt to change this license
Click nbfs://nbhost/SystemFileSystem/Templates/XML/XMLDocument.xml to edit this template
-->
<supermercado xmlns:xsi="http://www.w3.org/2001/XMLSchema-instance"
 xsi:noNamespaceSchemaLocation="UD4_T4B_tarefa_A_yagootero.xsd">
   <articulo id="articulo1">
     <descripcion>Leche desntada</descripcion>
     <marca>Pascual</marca>
     <medida>1 L</medida>
     <seccion>Leche y Batidos</seccion>
   </articulo>
   <articulo id="articulo2">
     <descripcion>Leche entera</descripcion>
     <marca>Puleva</marca>
     <medida>1,5 L</medida>
     <seccion>Leche y Batidos</seccion>
     <oferta>Lote descuento</oferta>
     <oferta>Dos por uno</oferta>
     <perecedero>
        <fabricacion>Enero2010</fabricacion>
     </perecedero>
   </articulo>
   <articulo id="articulo3">
     <descripcion>Tomate s</descripcion>
     <medida>1 Kg</medida>
     <seccion>Frutas y verduras</seccion>
     <perecedero>
        <caducidad>Febrero2010</caducidad>
     </perecedero>
   </articulo>
</supermercado>

